{
  "$schema": "https://json-schema.org/draft/2020-12/schema",
  "$id": "https://fika-os.local/schemas/pack-4/booking-price-snapshot.schema.json",
  "title": "Booking Price Snapshot",
  "description": "Draft business schema for immutable accepted pricing snapshots and amendment versions from BOOK-004.",
  "type": "object",
  "additionalProperties": false,
  "required": [
    "schemaVersion",
    "id",
    "sourceDecisionIds",
    "bookingId",
    "snapshotVersion",
    "snapshotStatus",
    "immutableAfterAcceptance",
    "bookingTotalExVat",
    "createdAt",
    "updatedAt"
  ],
  "properties": {
    "schemaVersion": {
      "type": "string",
      "const": "pack-4-draft"
    },
    "id": {
      "type": "string",
      "minLength": 1
    },
    "sourceDecisionIds": {
      "type": "array",
      "items": {
        "type": "string"
      },
      "minItems": 1
    },
    "createdAt": {
      "type": "string",
      "format": "date-time"
    },
    "updatedAt": {
      "type": "string",
      "format": "date-time"
    },
    "notes": {
      "type": "string"
    },
    "bookingId": {
      "type": "string"
    },
    "snapshotVersion": {
      "type": "integer",
      "minimum": 1
    },
    "snapshotStatus": {
      "type": "string",
      "enum": [
        "submitted",
        "accepted",
        "superseded_by_amendment"
      ]
    },
    "immutableAfterAcceptance": {
      "type": "boolean",
      "const": true
    },
    "supersedesSnapshotId": {
      "type": "string"
    },
    "lineTotal": {
      "type": "object",
      "additionalProperties": false,
      "required": [
        "amount",
        "currency"
      ],
      "properties": {
        "amount": {
          "type": "integer",
          "description": "Minor currency units."
        },
        "currency": {
          "type": "string",
          "minLength": 3,
          "maxLength": 3
        }
      }
    },
    "chargesTotal": {
      "type": "object",
      "additionalProperties": false,
      "required": [
        "amount",
        "currency"
      ],
      "properties": {
        "amount": {
          "type": "integer",
          "description": "Minor currency units."
        },
        "currency": {
          "type": "string",
          "minLength": 3,
          "maxLength": 3
        }
      }
    },
    "bookingTotalExVat": {
      "type": "object",
      "additionalProperties": false,
      "required": [
        "amount",
        "currency"
      ],
      "properties": {
        "amount": {
          "type": "integer",
          "description": "Minor currency units."
        },
        "currency": {
          "type": "string",
          "minLength": 3,
          "maxLength": 3
        }
      }
    },
    "vatTotal": {
      "type": "object",
      "additionalProperties": false,
      "required": [
        "amount",
        "currency"
      ],
      "properties": {
        "amount": {
          "type": "integer",
          "description": "Minor currency units."
        },
        "currency": {
          "type": "string",
          "minLength": 3,
          "maxLength": 3
        }
      }
    },
    "bookingTotalIncVat": {
      "type": "object",
      "additionalProperties": false,
      "required": [
        "amount",
        "currency"
      ],
      "properties": {
        "amount": {
          "type": "integer",
          "description": "Minor currency units."
        },
        "currency": {
          "type": "string",
          "minLength": 3,
          "maxLength": 3
        }
      }
    }
  }
}
